org_key,title,unjobs_url,original_url,exclusion_reason
undp,"Environmental & Social Safeguards (ESS) Analyst, Kathmandu, Nepal",https://unjobs.org/vacancies/1773470300888,,no_grade
undp,"Investigations Specialist (Home-Based) (Open to Tier 1 and 2), New York, United States",https://unjobs.org/vacancies/1773470306338,,no_grade
undp,"Project Associate (Office Based) [Open to internal and external applicants], Brasilia, Brazil",https://unjobs.org/vacancies/1773470308824,,no_grade
undp,"Project Associate (Data Management), Dhaka, Bangladesh",https://unjobs.org/vacancies/1773470312635,,no_grade
undp,"Public Information Associate/ Media  Focal Point (Nationals only), East Jerusalem, occupied Palestinian territory",https://unjobs.org/vacancies/1773470317999,,no_grade
undp,"Asociada(o) Técnica(o) en Refrigeración, San Jose, Costa Rica",https://unjobs.org/vacancies/1773470320511,,no_grade
undp,"Framework- National IT Specialist, Albania",https://unjobs.org/vacancies/1773496579926,,no_grade
undp,"National Livelihoods and Safeguards Expert, South Africa",https://unjobs.org/vacancies/1773496592550,,no_grade
undp,"INC - IC para realizador audiovisual que acompañe proyectos de protección social, Colombia",https://unjobs.org/vacancies/1773496605212,,no_grade
undp,"Hackathon Technical Advisor for EPRA Research & Innovation Conference, Kenya",https://unjobs.org/vacancies/1773496615881,,no_grade
undp,"UNDP-IC-2026-057; Expert for MTR, GEF PSELP, Pakistan",https://unjobs.org/vacancies/1773496628240,,no_grade
undp,"Facilitator for Climate Economy Modelling, Philippines",https://unjobs.org/vacancies/1773496640883,,no_grade
undp,"National Consultant End-of-Strategy Evaluation, South Sudan",https://unjobs.org/vacancies/1773496648666,,intern_consultant
undp,"Qu26/03076 EMAG/National Consultant Digital Analyst for the National Employment, Moldova, Republic of",https://unjobs.org/vacancies/1773496685658,,intern_consultant
undp,"National Civic and Voter Education Consultant, South Sudan, South Sudan",https://unjobs.org/vacancies/1773496695029,,intern_consultant
undp,"Chief International Technical Consultant (CITC), Uzbekistan",https://unjobs.org/vacancies/1773496721039,,intern_consultant
undp,"IC 10/2026 ARG/GENERO, Argentina",https://unjobs.org/vacancies/1773496745003,,no_grade
undp,"INC - IC Consultor/a en arquitectura y visualización de datos, Colombia",https://unjobs.org/vacancies/1773496756137,,no_grade
undp,"International Digital Systems Specialist, Georgia",https://unjobs.org/vacancies/1773496804438,,no_grade
undp,"Qu26/03214_PFD/National Tax for SDGs Consultant, Moldova, Republic of",https://unjobs.org/vacancies/1773496854005,,intern_consultant
undp,"Negociación UNDP-ARG-00561, Argentina",https://unjobs.org/vacancies/1773496864850,,no_grade
undp,"INCL-Consultoría (internacional) fortalecimiento sector de generacion de vacunas, Colombia",https://unjobs.org/vacancies/1773496924380,,no_grade
undp,"RECRUTEMENT DE 4 CONSULTANTS POUR LE COMPTE DE L UNITE ENVIRONNEMENT EN 4 LOTS, Central African Republic",https://unjobs.org/vacancies/1773496934881,,no_grade
undp,"IC/2026/017 - Social and environmental safeguard (SES) expert, Mongolia",https://unjobs.org/vacancies/1773496943120,,no_grade
undp,"SIPA Sustainability and Exit Strategy Specialist, Indonesia",https://unjobs.org/vacancies/1773496956121,,no_grade
undp,"CONSULTANT/E NATIONAL/E APPUI AU FORUM DDR, Niger",https://unjobs.org/vacancies/1773496968300,,intern_consultant
undp,"National Consultant (Data visualization web development expert), Afghanistan",https://unjobs.org/vacancies/1773496980862,,intern_consultant
undp,"Consultant expert en finance durable, Benin",https://unjobs.org/vacancies/1773497017090,,intern_consultant
undp,"Project Coordinator (Open Tier 1 & Tier 2 Applicants), Rabat, Morocco",https://unjobs.org/vacancies/1773340410123,,no_grade
undp,"Analista de Proyecto en Financiamiento Verde (Open to external applicants), Guatemala City, Guatemala",https://unjobs.org/vacancies/1773383900382,,no_grade
undp,"Director, German Rep Office [Open to internal and external applicants], Berlin, Germany",https://unjobs.org/vacancies/1773383905312,,no_grade
undp,"National Project Coordinator (Open to external applicants), Port Moresby, Papua New Guinea",https://unjobs.org/vacancies/1773383908601,,no_grade
undp,"Procurement Associate [Open to internal and external applicants], Panama City, Panama",https://unjobs.org/vacancies/1773383912543,,no_grade
undp,"Analista de Cumplimiento Contractual de Proyectos de Ciudad Inteligente y Tecnología [Open to internal and external applicants], Guatemala City, Guatemala",https://unjobs.org/vacancies/1773383915637,,no_grade
undp,"Director of Communications [Open to internal and external applicants], New York, United States",https://unjobs.org/vacancies/1773383918976,,no_grade
undp,"Team Leader  -  Strategic Philanthropy and Innovative Giving [Open to Internal & External Candidates], Bonn, Germany",https://unjobs.org/vacancies/1773383922163,,no_grade
undp,"Meteorologist, Kathmandu, Nepal",https://unjobs.org/vacancies/1773383926970,,no_grade
undp,"National Consultant for Palm Oil Supply Chain Analysis and Technical Guideline, Indonesia",https://unjobs.org/vacancies/1773410858095,,intern_consultant
undp,"IC 775-2026 to prepare Business Plan 2027-2029  for PUC Proleter Resen, North Macedonia",https://unjobs.org/vacancies/1773410869156,,no_grade
undp,"Negociación UNDP-ARG-00562, Argentina",https://unjobs.org/vacancies/1773410882048,,no_grade
undp,"Asistencia diseño, desarrollo, implem. monitoreo modulos formativos - Arequipa, Peru",https://unjobs.org/vacancies/1773410939100,,no_grade
undp,"National Consultant to support training on resilient infrastructure and RILP, Maldives",https://unjobs.org/vacancies/1773410949714,,intern_consultant
undp,"National Consultant on NBSAP Alignment with Biodiversity Expenditure Review, Tajikistan",https://unjobs.org/vacancies/1773410962609,,intern_consultant
undp,"International Consultant for policy review, gap analysis, and training, Cambodia",https://unjobs.org/vacancies/1773411025564,,intern_consultant
undp,"Consultant(e) international(e) - Gouvernance locale et intégration genre NAP, Djibouti",https://unjobs.org/vacancies/1773411038488,,intern_consultant
undp,"International Consultant - End-of-Strategy Evaluation, South Sudan",https://unjobs.org/vacancies/1773411051125,,intern_consultant
undp,"Relocation Project Manager Pretoria, South Africa (One UN House/Common Premises), South Africa",https://unjobs.org/vacancies/1773411063601,,no_grade
undp,"LBN-CO- IC-66-26 International Waste Sector GHG Expert, Lebanon",https://unjobs.org/vacancies/1773411089072,,no_grade
undp,"Local Individual Consultant (IC) - Graphic Designer and Video Maker, Timor-Leste",https://unjobs.org/vacancies/1773411101614,,intern_consultant
undp,"Asistencia diseño, desarrollo, implem. monitoreo modulos formativos - Cusco, Peru",https://unjobs.org/vacancies/1773411114698,,no_grade
