org_key,title,unjobs_url,original_url,exclusion_reason
undp,"Transportation Clerk/Driver, Kyiv, Ukraine",https://unjobs.org/vacancies/1773254060401,,no_grade
undp,"Procurement Associate, Kathmandu, Nepal",https://unjobs.org/vacancies/1773239606425,,no_grade
undp,"Research & Conflict Prevention Officer, Baghdad, Iraq",https://unjobs.org/vacancies/1773239562317,,no_grade
undp,"Sustainable Airport Logistics Specialist, Mbabane, Eswatini",https://unjobs.org/vacancies/1773239538683,,no_grade
undp,"INCL IC Consultoría proveer servicios investigador/a cuantit-cuali Educación, Colombia",https://unjobs.org/vacancies/1773239125456,,no_grade
undp,"LBN/CO/IC/28/26-CALL FOR ROSTER, Lebanon",https://unjobs.org/vacancies/1773239112896,,no_grade
undp,"National IC to conduct a feasibility assessment and study on government response, Uganda",https://unjobs.org/vacancies/1773239100984,,no_grade
undp,"Appui à la préparation de la demande de financement conjointe VIH, Algeria",https://unjobs.org/vacancies/1773239086999,,no_grade
undp,"CRFM-IC-Telecommunications and ICT Expert for Data and Analytics, Bosnia and Herzegovina",https://unjobs.org/vacancies/1773239074669,,no_grade
undp,"consultant(e) national(e) spécialiste en analyse politique et institutionnelle, Congo",https://unjobs.org/vacancies/1773239011598,,intern_consultant
undp,"Consultor/a territorial de acompañamiento psicosocial, Cali, Colombia",https://unjobs.org/vacancies/1773239003730,,no_grade
undp,"INCL - Consultor/a territorial de acompañamiento psicosocial, Bogotá D.C., Colombia",https://unjobs.org/vacancies/1773238960231,,no_grade
undp,"Recrutement d un (e) Consultant (e) national (e) Spécialiste en Génie Civile, Comoros",https://unjobs.org/vacancies/1773238877950,,intern_consultant
undp,"Hiring of a Water, Sanitation and Hygiene (WASH) Expert, Pakistan",https://unjobs.org/vacancies/1773238854799,,no_grade
undp,"UNDP/PN/02/2026 ""REBID"" - BIOFIN - Biodiversity Expert (National Consultant), Nepal",https://unjobs.org/vacancies/1773238830206,,intern_consultant
undp,"IC 08/2026 ARG/GÉNERO, Argentina",https://unjobs.org/vacancies/1773238797163,,no_grade
undp,"Asistencia diseño, desarrollo, implem. monitoreo modulos formativos, Peru",https://unjobs.org/vacancies/1773238783741,,no_grade
undp,"Digital Archiving Specialist, Vanuatu",https://unjobs.org/vacancies/1773238773341,,no_grade
undp,"Asistencia diseño, desarrollo, implem. monitoreo modulos formativos, Peru",https://unjobs.org/vacancies/1773238760490,,no_grade
undp,"Recrutement d un(e) Consultant(e) national(e)en MRV des GES et suivi de la CDN 2, Djibouti",https://unjobs.org/vacancies/1773238747756,,intern_consultant
undp,"la Surveillance Bio-Comportementale de Populations-clés (IBBS IST/VIH), Algeria",https://unjobs.org/vacancies/1773238698480,,no_grade
undp,"IC 07/2026 ARG/GÉNERO, Argentina",https://unjobs.org/vacancies/1773238658946,,no_grade
undp,"UNDP Liberia is Recruiting a Biodiversity Finance Specialist, Liberia",https://unjobs.org/vacancies/1773238645626,,no_grade
undp,"Local Consultant-Developing Business Plan for the Arbitration & Mediation Center, Armenia",https://unjobs.org/vacancies/1773238632207,,intern_consultant
undp,"Impact Measurement Verification and Learning Analyst, Bangkok, Thailand",https://unjobs.org/vacancies/1773210977751,,no_grade
undp,"Project Management Specialist (GCF-SACCR project) [Open to internal and external applicants], Hanoi",https://unjobs.org/vacancies/1773210972943,,no_grade
undp,"Consultoría local para apoyar al MA en la creación de personajes pedagógicos, Uruguay",https://unjobs.org/vacancies/1772891769112,,no_grade
undp,"Programme Support Intern, Pretoria, South Africa",https://unjobs.org/vacancies/1773169276354,,intern_consultant
undp,"Programme Associate [Open to Tier 0, 1 & 2 applicants], Belgrade, Serbia",https://unjobs.org/vacancies/1773242952057,,no_grade
undp,"Finance and Operations Analyst, Cairo, Egypt",https://unjobs.org/vacancies/1773242957117,,no_grade
undp,"Watershed Management Analyst, Kathmandu, Nepal",https://unjobs.org/vacancies/1773242960117,,no_grade
undp,"Project Analyst (Open to External Applicants), Djibouti",https://unjobs.org/vacancies/1773242963636,,no_grade
undp,"National Project Admin and Finance Officer, Dili, Timor-Leste",https://unjobs.org/vacancies/1773242967159,,no_grade
undp,"Project Coordination Officer [Open to external applicants], Tbilisi, Georgia",https://unjobs.org/vacancies/1773242972721,,no_grade
undp,"Procurement Analyst (Open to external applicants), Apia, Samoa",https://unjobs.org/vacancies/1773242975510,,no_grade
undp,"National Coordinatinator [Open to all applicants], Kampala, Uganda",https://unjobs.org/vacancies/1773242978567,,no_grade
undp,"Conscious Food Systems Alliance (CoFSA) Programme Coordinator (Home Based) [Open to external applicants], Panama City, Panama",https://unjobs.org/vacancies/1773254054825,,no_grade
undp,"Public Health Intern (Vietnamese National), Hanoi",https://unjobs.org/vacancies/1773169331221,,intern_consultant
undp,"Research Intern - SDG Finance Portfolio - Turkish Speaking, Istanbul",https://unjobs.org/vacancies/1773169320619,,intern_consultant
undp,"Project Associate (Climate Change)-  (Kurigram); (Borguna); (Bhola), Barisal, Bangladesh",https://unjobs.org/vacancies/1773169298647,,no_grade
undp,"Research Fellow, Istanbul",https://unjobs.org/vacancies/1773169266668,,no_grade
undp,"Project Analyst - Monitoring and Evaluation (Open to external applicants), Hanoi",https://unjobs.org/vacancies/1773169234283,,no_grade
undp,"Project Associate (MIS), Dhaka, Bangladesh",https://unjobs.org/vacancies/1773169228168,,no_grade
undp,"Practicante de Atraccion de Inversion, Mexico",https://unjobs.org/vacancies/1773169231666,,no_grade
undp,"Analista de Atraccion de Inversion, Mexico",https://unjobs.org/vacancies/1773169252329,,no_grade
undp,"Auxiliar Juridico en Proyectos de Cooperacion, Mexico",https://unjobs.org/vacancies/1773169263977,,no_grade
undp,"Asociado(a) en Gestion Administrativa y Control Presupuestal, Mexico",https://unjobs.org/vacancies/1773169306577,,no_grade
undp,"Human Resources Associate (Open to external applicants), Port Moresby, Papua New Guinea",https://unjobs.org/vacancies/1772951537625,,no_grade
undp,"Project Manager - Climate, Gender and Conflict [Open to external applicants], Mount Hagen, Papua New Guinea",https://unjobs.org/vacancies/1773169309100,,no_grade
undp,"Digital Product Manager [Open to Tier 1 & 2 applicants], Home-Based, Geneva",https://unjobs.org/vacancies/1773169247164,,no_grade
