org_key,title,unjobs_url,original_url,exclusion_reason
undp,"Consultant national Senior en Gouvernance et Opérationnalisation du Suivi-Évalua, Tunisia",https://unjobs.org/vacancies/1772114678114,,intern_consultant
undp,"National Individual Consultant for Mapping the Regulatory Framework and Sector, Zambia",https://unjobs.org/vacancies/1772114658582,,intern_consultant
undp,"DES - LTA IC Conceptos jurídicos sobre titularidad predios postulados a proyecto, Colombia",https://unjobs.org/vacancies/1772114635126,,no_grade
undp,"INCL - Consultor/a en Procesos Metodológicos para el Fortalecimiento de la Polít, Colombia",https://unjobs.org/vacancies/1772114626546,,no_grade
undp,"Results-Based Climate Budgeting Expert, Philippines",https://unjobs.org/vacancies/1772114587005,,no_grade
undp,"Local Consultant to Develop and Pilot Citizen Journalism Training Program, Maldives",https://unjobs.org/vacancies/1772114524183,,intern_consultant
undp,"Redact/National Expert on Virtual Assets and Crypto-Enabled Crime, Moldova",https://unjobs.org/vacancies/1772114513980,,no_grade
undp,"Project Analyst (Marawi City) [Open to Tier 1 & 2 applicants], Philippines",https://unjobs.org/vacancies/1772119539571,,no_grade
undp,"Programme and Operations Support Analyst (Home Based), Geneva",https://unjobs.org/vacancies/1772119530729,,no_grade
undp,"Administrative and Finance Associate (Marawi City) [Open to Tier 1 & 2 applicants], Philippines",https://unjobs.org/vacancies/1772119527080,,no_grade
undp,"CONSULTANT(E) NATIONAL(E)_L'ÉVALUATION FINALE INDÉPENDANTE_PROGRAMME, Democratic Republic of Congo",https://unjobs.org/vacancies/1772114789629,,intern_consultant
undp,"CONSULTANT INTERNATIONAL CHARGÉ DE FOURNIR L'ASSISTANCE TECHNIQUE À LA DELIVERY, Democratic Republic of Congo",https://unjobs.org/vacancies/1772114689657,,intern_consultant
undp,"Programme Implementation Analyst, Cook Islands",https://unjobs.org/vacancies/1772091542734,,no_grade
undp,"Communications Analyst, Ulaanbaatar, Mongolia",https://unjobs.org/vacancies/1772091530355,,no_grade
undp,"Regional Technical Specialist on Cooling, Circularity, and Pollution Prevention, Amman, Jordan",https://unjobs.org/vacancies/1772091535346,,no_grade
undp,"Programme Specialist  -  Environment and Climate Change (Open to Tier 0 & 1 & 2 applicants), Paramaribo, Suriname",https://unjobs.org/vacancies/1772091539784,,no_grade
undp,"Comprehensive desk-based gender analysis across the 11 thematic areas, Ukraine",https://unjobs.org/vacancies/1772114462768,,no_grade
undp,"Greenhouse Gases (GHG) Specialist, Indonesia",https://unjobs.org/vacancies/1772114502214,,no_grade
undp,"National Consultant: Development of Operations Manual, Philippines",https://unjobs.org/vacancies/1772114670056,,intern_consultant
undp,"IC- Legal Expert on Functional and Business Process Analysis for the Free Legal, Albania",https://unjobs.org/vacancies/1772114712831,,no_grade
undp,"IC- Finance Expert on Functional and Business Process Analysis for the Free Lega, Albania",https://unjobs.org/vacancies/1772114736558,,no_grade
undp,"Technical Planner -Development of Strategic Plan for a Resilient Iranun Corridor, Philippines",https://unjobs.org/vacancies/1772114747637,,no_grade
undp,"UNDP-IC-2026-035: National Project Coordinator under the ASGM Project, Pakistan",https://unjobs.org/vacancies/1772114755354,,no_grade
undp,"Endline study and final external evaluation of Political Stabilization project, Guinea-Bissau",https://unjobs.org/vacancies/1772114766885,,no_grade
undp,"UNDP-IC-2026-038; Promote Sustainable Biomass Energy Systems, Pakistan",https://unjobs.org/vacancies/1772114779052,,no_grade
