org_key,title,unjobs_url,original_url,exclusion_reason
undp,"Climate Action Associate, Climate Action Associate, Praia, Cape Verde",https://unjobs.org/vacancies/1772547221267,,no_grade
undp,"Chauffeur, Niamey, Niger",https://unjobs.org/vacancies/1772551806653,,no_grade
undp,"Program Officer-UNOCHA-(Nationals Only)-In Malakal, Malakal, South Sudan",https://unjobs.org/vacancies/1772551812801,,no_grade
undp,"Internship Roster, Cairo, Egypt",https://unjobs.org/vacancies/1772551817168,,intern_consultant
undp,"Business Development Analyst, Short-Term, Chisinau, Moldova",https://unjobs.org/vacancies/1772551828543,,no_grade
undp,"Program Officer-UNOCHA-(Nationals Only) in Bentiu, Bentiu, South Sudan",https://unjobs.org/vacancies/1772551840264,,no_grade
undp,"Monitoring & Evaluation Analyst, Kuala Lumpur, Malaysia",https://unjobs.org/vacancies/1772551842622,,no_grade
undp,"Monitoring and Reporting Analyst, NPSA-8, DS - Kyiv (National Position), Kyiv, Ukraine",https://unjobs.org/vacancies/1772551845080,,no_grade
undp,"Project Analyst, NPSA-8, DS-Kyiv, National Position, Kyiv, Ukraine",https://unjobs.org/vacancies/1772551848592,,no_grade
undp,"Project Associate, NPSA-7, DS - Kyiv (National Position), Kyiv, Ukraine",https://unjobs.org/vacancies/1772551851130,,no_grade
undp,"Communications Analyst - Projects & Client Support [Open to Tier 1 & 2 applicants] - Home-based, Copenhagen, Denmark",https://unjobs.org/vacancies/1772551853773,,no_grade
undp,"Analista em Defesa Cibernética  (1 vaga) (Home Based) - [Open to all applicants], Brasilia, Brazil",https://unjobs.org/vacancies/1772583042376,,no_grade
undp,"AI Hub Programme Specialist-(Open to all applicants), Rome, Italy",https://unjobs.org/vacancies/1772583047797,,no_grade
undp,"Programme Manager, Global Fund [Open to Tier 1 and 2 applicants only], Bata, Equatorial Guinea",https://unjobs.org/vacancies/1772583052759,,no_grade
undp,"Grants Officer, Philippines",https://unjobs.org/vacancies/1772601519499,,no_grade
undp,"Transportation Clerk/Driver, Kyiv, Ukraine",https://unjobs.org/vacancies/1772465282070,,no_grade
undp,"Project Administrative Associate [Open to external applicants], Dushanbe, Tajikistan",https://unjobs.org/vacancies/1772465278542,,no_grade
undp,"Technical and Operational Assistant for the Scholarship Subsidy Programme, Panama City, Panama",https://unjobs.org/vacancies/1772465275050,,no_grade
undp,"Human Resources Associate, Praia, Cape Verde",https://unjobs.org/vacancies/1772465270950,,no_grade
undp,"Local Investment and Business Development Analyst, Chisinau, Moldova",https://unjobs.org/vacancies/1772465256888,,no_grade
undp,"Roster of Interns (open call), Belgrade, Serbia",https://unjobs.org/vacancies/1772465245651,,no_grade
undp,"Mental Health Literacy Analyst (Home Based), Remote",https://unjobs.org/vacancies/1772465240415,,no_grade
undp,"National Consultant on Stock Market Development, Turkmenistan",https://unjobs.org/vacancies/1772460559085,,intern_consultant
undp,"Relocation Project Manager, Pretoria, South Africa",https://unjobs.org/vacancies/1772460547138,,no_grade
undp,"La revue du Manuel de prévention combinée auprès des populations clés et mobiles, Algeria",https://unjobs.org/vacancies/1772460450276,,no_grade
undp,"Recrutement Consultant National Elaboration du rapport volontaire ODD 2026, Guinea",https://unjobs.org/vacancies/1772460440460,,intern_consultant
undp,"Local Expert for the Mid-Term Review (MTR) of the GEF Global Wildlife Programme, Malaysia",https://unjobs.org/vacancies/1772460401250,,no_grade
undp,"EMAG/National Consultants on ESCO (European Classification of Skills, Moldova",https://unjobs.org/vacancies/1772460356085,,no_grade
undp,"Appui à la préparation de la demande de financement conjointe VIH, Algeria",https://unjobs.org/vacancies/1772460332338,,no_grade
undp,"Consultoría para el Fortalecimiento del Monitoreo Estratégico del MCP, Bolivia",https://unjobs.org/vacancies/1772460294160,,no_grade
undp,"Consultant for Baseline Assessment and Logframe Finalization for SLPI Phase II, Indonesia",https://unjobs.org/vacancies/1772460283621,,intern_consultant
undp,"National Consultant - Financial Advisory Support Services, Bangladesh",https://unjobs.org/vacancies/1772460246792,,intern_consultant
undp,"Gender Disparity in Pakistan Research, Pakistan",https://unjobs.org/vacancies/1772460234141,,no_grade
undp,"Support Specialist in Karst Ecosystem Conservation, Indonesia",https://unjobs.org/vacancies/1772460221937,,no_grade
undp,"IGTRAC/National Consultant on Employment and Labour Market Inclusion, Moldova",https://unjobs.org/vacancies/1772460211292,,intern_consultant
undp,"Partnership Analyst [Open to Tier 1 & 2 applicants], Bangkok, Thailand",https://unjobs.org/vacancies/1772436921936,,no_grade
undp,"PAZ - Consultoría para el diseño y desarrollo de una formación en técnicas, Colombia",https://unjobs.org/vacancies/1772373208118,,no_grade
undp,"National Consultant for Mid Term Review for INFLORES Project, Indonesia",https://unjobs.org/vacancies/1772373269079,,intern_consultant
undp,"National Senior Tribal Advisor to Ministry of Tribal Affairs, India",https://unjobs.org/vacancies/1771596606098,,no_grade
undp,"Programme Analyst, Comprehensive Sexuality Education, Nairobi, Kenya",https://unjobs.org/vacancies/1771601238746,,no_grade
undp,"Cybersecurity Analyst, Chisinau, Moldova",https://unjobs.org/vacancies/1771428409741,,no_grade
undp,"IC for Training on Environmental Justice, Pakistan",https://unjobs.org/vacancies/1772373182218,,no_grade
undp,"IC for Training on Promoting Peace and Environmental Justice, Pakistan",https://unjobs.org/vacancies/1772373171718,,no_grade
undp,"Strengthening Punjab Integrated Financing Strategy, Pakistan",https://unjobs.org/vacancies/1772373132159,,no_grade
undp,"Legal Expert, Pakistan",https://unjobs.org/vacancies/1772201137953,,no_grade
undp,"CALL FOR ROSTER, Lebanon",https://unjobs.org/vacancies/1772201249117,,no_grade
undp,"IC for Midterm Evaluation of the Applied SME Capability Center, Turkey",https://unjobs.org/vacancies/1772201282723,,no_grade
undp,"PAZ - Consultoría de apoyo jurídico experto para proceso de capacitación, Colombia",https://unjobs.org/vacancies/1772201294261,,no_grade
undp,"PAZ - IC Consultoría para el diseño e implementación de Sistemas de Alerta Tempr, Colombia",https://unjobs.org/vacancies/1772201311591,,no_grade
undp,"INCL - IC documento atención integral personas mayores en situación de calle, Colombia",https://unjobs.org/vacancies/1772201331331,,no_grade
