org_key,title,unjobs_url,original_url,exclusion_reason
unhcr,"UNOPS Registration Clerk, Lago Agrio, Ecuador",https://unjobs.org/vacancies/1772831378634,,no_grade
unhcr,"Shelter/WASH Associate, Uvira, Democratic Republic of Congo",https://unjobs.org/vacancies/1772831328160,,no_grade
unhcr,"Protection Associate, Kaoma, Zambia",https://unjobs.org/vacancies/1772831341918,,no_grade
unhcr,"Associate Programme Officer, Tahoua, Niger",https://unjobs.org/vacancies/1772831351434,,no_grade
unhcr,"Senior Supply Assistant, Quetta, Pakistan",https://unjobs.org/vacancies/1772831361148,,no_grade
unhcr,"Senior Protection Assistant, Lima, Peru",https://unjobs.org/vacancies/1772831369594,,no_grade
unhcr,"Senior Communications Assistant, Kyiv, Ukraine",https://unjobs.org/vacancies/1772831388693,,no_grade
unhcr,"Associate Education Officer, Islamabad, Pakistan",https://unjobs.org/vacancies/1772831398980,,no_grade
unhcr,"Information Management Associate, Islamabad, Pakistan",https://unjobs.org/vacancies/1772831407873,,no_grade
unhcr,"Assistant Community-Based Protection Officer, Faradje, Democratic Republic of Congo",https://unjobs.org/vacancies/1772831416808,,no_grade
unhcr,"Development Officer, Ouagadougou, Burkina Faso",https://unjobs.org/vacancies/1772831426412,,no_grade
unhcr,"Associate PSP Officer (AI Developer), Copenhagen, Denmark",https://unjobs.org/vacancies/1772831435913,,no_grade
unhcr,"Health Information System Officer, Geneva, Switzerland",https://unjobs.org/vacancies/1772831454221,,no_grade
unhcr,"Senior IT Assistant, Bangui, Central African Republic",https://unjobs.org/vacancies/1772831463505,,no_grade
unhcr,"Protection Associate, Ankara, Türkiye",https://unjobs.org/vacancies/1772831471719,,no_grade
unhcr,"Operations Associate (Education), Harare, Zimbabwe",https://unjobs.org/vacancies/1772831480923,,no_grade
unhcr,"Assistant(e) Principal (e) au rapatriement, Assistant(e) Principal (e) au rapatriement, Kanga Bandoro, Central African Republic",https://unjobs.org/vacancies/1772721390403,,no_grade
unhcr,"Associate Registration and Identity Management Officer, Associate Registration and Identity Management Officer, Adjumani/Pakelle, Uganda",https://unjobs.org/vacancies/1772721346029,,no_grade
unhcr,"Associate Supply Officer, Associate Supply Officer, Sin Paung Wei, Myanmar",https://unjobs.org/vacancies/1772721222174,,no_grade
unhcr,"Associate Registration and Identity Management Officer, Associate Registration and Identity Management Officer, Yumbe, Uganda",https://unjobs.org/vacancies/1772721087663,,no_grade
unhcr,"Charge de  MEAL, Bamako, Mali",https://unjobs.org/vacancies/1772547269982,,no_grade
unhcr,"Electrician, Gambella, Ethiopia",https://unjobs.org/vacancies/1772653724277,,no_grade
unhcr,"Protection Assistant, Bassikounou, Mauritania",https://unjobs.org/vacancies/1772653683245,,no_grade
unhcr,"Assistant Data Management Officer - Gov, Brasilia, Brazil",https://unjobs.org/vacancies/1772653641715,,no_grade
unhcr,"Education Associate, Quetta, Pakistan",https://unjobs.org/vacancies/1772634027220,,no_grade
unhcr,"Senior Field Assistant, Irbid, Jordan",https://unjobs.org/vacancies/1772634018220,,no_grade
unhcr,"Engineer - Civil Works Supervision and Contract Management, Pemba, Mozambique",https://unjobs.org/vacancies/1772634009345,,no_grade
unhcr,"Associate External Relations Officer, Tehran, Iran",https://unjobs.org/vacancies/1772633991134,,no_grade
unhcr,"Site Planning Officer, Addis, Ethiopia",https://unjobs.org/vacancies/1772633982939,,no_grade
unhcr,"External Relations Intern, Seoul, Republic of Korea",https://unjobs.org/vacancies/1772633974008,,intern_consultant
unhcr,"Associate Resettlement and Complementary Pathways Officer, Niamey, Niger",https://unjobs.org/vacancies/1772633965045,,no_grade
unhcr,"Public Relations (PR) Manager - Individual Contractor, Geneva, Switzerland",https://unjobs.org/vacancies/1772633956913,,intern_consultant
unhcr,"Senior Reporting Assistant, Nampula, Mozambique",https://unjobs.org/vacancies/1772633948374,,no_grade
unhcr,"External Relations Officer, Damascus, Syria",https://unjobs.org/vacancies/1772633939623,,no_grade
unhcr,"Building Services Assistant, Gambella, Ethiopia",https://unjobs.org/vacancies/1772633914686,,no_grade
unhcr,"Senior Protection Associate, Manila, Philippines",https://unjobs.org/vacancies/1772633897963,,no_grade
unhcr,"Building Services Associate, Addis, Ethiopia",https://unjobs.org/vacancies/1772633889984,,no_grade
unhcr,"Data Management Associate, Toronto, Canada",https://unjobs.org/vacancies/1772633880711,,no_grade
unhcr,"Electrician, Asosa, Ethiopia",https://unjobs.org/vacancies/1772633872362,,no_grade
unhcr,"Senior Protection Associate, Manila, Philippines",https://unjobs.org/vacancies/1772633863583,,no_grade
unhcr,"Assistant Public Health Officer, Kassala, Sudan",https://unjobs.org/vacancies/1772633854442,,no_grade
unhcr,"Inter-Agency Coordination Associate, Bertoua, Cameroon",https://unjobs.org/vacancies/1772633821571,,no_grade
unhcr,"Building Services Assistant, Gambella, Ethiopia",https://unjobs.org/vacancies/1772633813514,,no_grade
unhcr,"Protection Associate, Irbid, Jordan",https://unjobs.org/vacancies/1772633805243,,no_grade
unhcr,"Associate Protection Officer, Cairo, Egypt",https://unjobs.org/vacancies/1772633788607,,no_grade
unhcr,"Assistant Protection Officer, Tel Aviv, Israel",https://unjobs.org/vacancies/1772633922812,,no_grade
unhcr,"Field Associate, Dalbandin, Pakistan",https://unjobs.org/vacancies/1772633931657,,no_grade
unhcr,"Senior Building Services Assistant, Melkadida, Ethiopia",https://unjobs.org/vacancies/1772634000569,,no_grade
unhcr,"Senior Public Health Associate, Port Sudan, Sudan",https://unjobs.org/vacancies/1772633905546,,no_grade
unhcr,"Senior Protection Assistant, Xai Xai, Mozambique",https://unjobs.org/vacancies/1772633846537,,no_grade
