org_key,title,unjobs_url,original_url,exclusion_reason
unicef,"Social Policy Officer (Public Finance), Maseru, Lesotho",https://unjobs.org/vacancies/1774361117070,,no_grade
unicef,"Operations Officer, Warsaw, Poland",https://unjobs.org/vacancies/1774361011565,,no_grade
unicef,"National Consultant: Editorial Production Visibility, Yangon, Myanmar",https://unjobs.org/vacancies/1774361002229,,intern_consultant
unicef,"Consultant - Humanitarian Planning Coordination and Operational Support Emergency and Field Coordination, Addis Ababa, Ethiopia",https://unjobs.org/vacancies/1774360992317,,intern_consultant
unicef,"Regional SADC Consultant on Foundational Learning Advocacy and Policy Engagement Global Education Practice E - Remote, Nairobi, Kenya",https://unjobs.org/vacancies/1774360961760,,intern_consultant
unicef,"Sierra Leone Senior Consultant (Remote), London, United Kingdom",https://unjobs.org/vacancies/1774360951729,,intern_consultant
unicef,"Return and Reintegration National Expert, Kyiv, Ukraine",https://unjobs.org/vacancies/1774360941377,,no_grade
unicef,"Use of Stable coin for Cash-Based Programming in Humanitarian Contexts: Global Cash Hub, Geneva",https://unjobs.org/vacancies/1774360971741,,no_grade
unicef,"Education Officer- Inclusive Education, Male",https://unjobs.org/vacancies/1774360981913,,no_grade
unicef,"International Consultant for Technical Support to the Functional Review for the 2027-2031 CPMP, Vientiane, Lao PDR",https://unjobs.org/vacancies/1774334086700,,intern_consultant
unicef,"Programme Assistant, Santo Domingo, Dominican Republic",https://unjobs.org/vacancies/1774301847255,,no_grade
unicef,"Human Resources Assistant, Santo Domingo, Dominican Republic",https://unjobs.org/vacancies/1774301807350,,no_grade
unicef,"Child Protection Officer, Toamasina, Antananarivo, Madagascar",https://unjobs.org/vacancies/1774301728807,,no_grade
unicef,"Education Officer- Adolescent Skills Development, Male",https://unjobs.org/vacancies/1774334096782,,no_grade
unicef,"Research Specialist, Florence, Italy",https://unjobs.org/vacancies/1774301838087,,no_grade
unicef,"Research Specialist, Florence, Italy",https://unjobs.org/vacancies/1774301826160,,no_grade
unicef,"Research Specialist, Florence, Italy",https://unjobs.org/vacancies/1774301784573,,no_grade
unicef,"National Consultancy for Public Finance for Nutrition, Vientiane, Lao PDR",https://unjobs.org/vacancies/1774334074659,,intern_consultant
unicef,"National Consultant to support the capacity-building of UNICEF implementing partners on Preparedness and Emergency Response in line with the Core Commitments for Children in Humanitarian Action (CCCs), Damascus, Syria",https://unjobs.org/vacancies/1774334107226,,intern_consultant
unicef,"Supply Chain Specialist (Data), Supply Division, Copenhagen",https://unjobs.org/vacancies/1774273916866,,no_grade
unicef,"WASH in Schools Officer, Honiara, Solomon Islands",https://unjobs.org/vacancies/1774274048547,,no_grade
unicef,"Operations Specialist, Aleppo, Syria",https://unjobs.org/vacancies/1774273947146,,no_grade
unicef,"Child Protection Specialist (PSEA Child Rights VAC Justice), Niamey, Niger",https://unjobs.org/vacancies/1774273937115,,no_grade
unicef,"Data and Analytics Consultant, London, United Kingdom",https://unjobs.org/vacancies/1774273906879,,intern_consultant
unicef,"Programme Associate, Hanoi, Viet Nam",https://unjobs.org/vacancies/1774273896572,,no_grade
unicef,"Administrative Assistant (Events Management), Nairobi, Kenya",https://unjobs.org/vacancies/1774273886371,,no_grade
unicef,"WASH Officer (CER), Manila, Philippines",https://unjobs.org/vacancies/1774247646581,,no_grade
unicef,"Education Officer (Digital Learning), Brazzaville, Congo",https://unjobs.org/vacancies/1774215353435,,no_grade
unicef,"&Ecy;&kcy;&scy;&pcy;&iecy;&rcy;&tcy; &pcy;&ocy; &ocy;&bcy;&rcy;&acy;&zcy;&ocy;&vcy;&acy;&ncy;&icy;&yucy; &pcy;&ocy; &vcy;&ncy;&iecy;&dcy;&rcy;&iecy;&ncy;&icy;&icy; &kcy;&ocy;&mcy;&pcy;&iecy;&tcy;&iecy;&ncy;&tcy;&ncy;&ocy;&scy;&tcy;&ncy;&ocy;-&ocy;&rcy;&icy;&iecy;&ncy;&tcy;&icy;&rcy;&ocy;&vcy;&acy;&ncy;&ncy;&ocy;&gcy;&ocy; &ocy;&bcy;&rcy;&acy;&zcy;&ocy;&vcy;&acy;&ncy;&icy;&yacy;, Bishkek, Kyrgyzstan",https://unjobs.org/vacancies/1774101230335,,no_grade
unicef,"Public Partnership Specialist - Public Partnerships Division (PPD), Washington",https://unjobs.org/vacancies/1774273926889,,no_grade
unicef,"National Facilitator, Monrovia, Liberia",https://unjobs.org/vacancies/1774128890662,,no_grade
unicef,"Consultoría: Revisión programática de género para la formulación del CPD 2028 - 2032, La Paz, Bolivia",https://unjobs.org/vacancies/1774128879122,,no_grade
unicef,"Senior Adviser (Education Financing for Scale), Panama City",https://unjobs.org/vacancies/1774128943715,,no_grade
unicef,"WASH Specialist, Sittwe, Myanmar",https://unjobs.org/vacancies/1774042632820,,no_grade
unicef,"Consultoría Individual - Análisis de Pobreza Infantil y Adolescente: Tendencias y consideraciones a partir de la medición de pobreza 2024, Mexico City, Mexico",https://unjobs.org/vacancies/1774042589607,,no_grade
unicef,"Intern Social Behavior Change & Behavioral Insights- Sustainability and Operation, Brussels",https://unjobs.org/vacancies/1774101220270,,intern_consultant
unicef,"ICT Associate, Dar es Salaam, Tanzania",https://unjobs.org/vacancies/1774016197167,,no_grade
unicef,"Audiovisual Design and Content Producer, Tegucigalpa, Honduras",https://unjobs.org/vacancies/1774016090445,,no_grade
unicef,"International Consultancy: Mid-Term Review of the GPE System Transformation and System Capacity Grants (STG and SCG), Freetown, Sierra Leone",https://unjobs.org/vacancies/1774016026966,,intern_consultant
unicef,"Consultant national : Spécialiste en Politique Sociale, Mopti, Mali",https://unjobs.org/vacancies/1774016037746,,intern_consultant
unicef,"Consultoría para Ingeniería de Software Full-Stack Senior ‘Una Sola Salud', Tegucigalpa, Honduras",https://unjobs.org/vacancies/1773988516440,,no_grade
unicef,"Consultor a individual para la gestión del conocimiento, Buenos Aires, Argentina",https://unjobs.org/vacancies/1773956491232,,no_grade
unicef,"Fund Raising Associate (Retention Campaigns), Santiago, Chile",https://unjobs.org/vacancies/1773956471149,,no_grade
unicef,"Consultor a Individual - Responsable de datos y gestión del conocimiento, Buenos Aires, Argentina",https://unjobs.org/vacancies/1773956418240,,no_grade
unicef,"Consultoría Internacional Individual para el fortalecimiento de la respuesta humanitaria del sector de Agua, Saneamiento e Higiene, San Salvador, El Salvador",https://unjobs.org/vacancies/1773956406234,,no_grade
unicef,Consultancy-Global Programme Division - Partnership for a Lead-Free Future (PLF) - (Home-based/Remote),https://unjobs.org/vacancies/1773956440055,,intern_consultant
unicef,"Public Sector Innovation Consultant Office of Innovation, Chennai, India",https://unjobs.org/vacancies/1773956429166,,intern_consultant
unicef,"County Convergence Coordinator, County Convergence Coordinator, Cestos City, Liberia",https://unjobs.org/vacancies/1773933365473,,no_grade
unicef,"WASH Engineer, Lviv, Ukraine",https://unjobs.org/vacancies/1773933343107,,no_grade
unicef,"County Convergence Coordinator, Monrovia, Liberia",https://unjobs.org/vacancies/1773933194124,,no_grade
