org_key,title,unjobs_url,original_url,exclusion_reason
unicef,"Programme Officer (Child Rights Monitoring) NO-2 Fixed Term, San Jose, Costa Rica",https://unjobs.org/vacancies/1772177680130,,no_grade
unicef,"UNICEF Mauritanie: Recrutement groupé : Deux postes de Chargé(e) de Programme Protection de l'Enfant NOB FT basés à (poste n°00094476) et à Sélibaby (poste n°115122) Mauritanie (Interne et Externe), Nouakchott, Mauritania",https://unjobs.org/vacancies/1772177711583,,intern_consultant
unicef,"Consultant national Médecin spécialiste en planification et gestion des projets pour appui technique au PSLS : rédaction demande de financement Fonds mondial 2027-2029 WCAR-Bénin 40 jours, Cotonou, Benin",https://unjobs.org/vacancies/1772177732448,,intern_consultant
unicef,"Internal - External VA: Administrative Assistant (General Admin & Contracting) GS-5 FT, Kinshasa, Democratic Republic of Congo",https://unjobs.org/vacancies/1772177742309,,no_grade
unicef,"UNICEF Pacific Consultancy: Dietary intake assessment in Isabel Western and Guadalcanal Provinces 75 working days over 5 months, Honiara, Solomon Islands",https://unjobs.org/vacancies/1772177751980,,intern_consultant
unicef,"Digital Social & Behavior Change (SBC) Consultant (Nationals only home-based), Maputo, Mozambique",https://unjobs.org/vacancies/1772201484611,,intern_consultant
unicef,"Re-advertisement: Individual National Consultancy to provide psychosocial support services for children and families as part of piloting diversion measures restorative justice and social work case support, Ashkhabad, Turkmenistan",https://unjobs.org/vacancies/1772201495094,,intern_consultant
unicef,"Internal & External VA: Chargé(e) de l 'Administration et des Finances NO-1 FT DRC, Kananga, Democratic Republic of Congo",https://unjobs.org/vacancies/1772201505607,,no_grade
unicef,"Social & Behavior Change Specialist, Yaounde, Cameroon",https://unjobs.org/vacancies/1772201516762,,no_grade
unicef,"Communication and Partnerships Consultant (Remote - Internationals only), Maputo, Mozambique",https://unjobs.org/vacancies/1772201527470,,intern_consultant
unicef,"National ECD Public Private Partnership Strategy consultant (Nationals only Office-based), Kigali, Rwanda",https://unjobs.org/vacancies/1772201537696,,intern_consultant
unicef,"Programme Associate (Vision Hub) Fixed Term G-6, Kyiv, Ukraine",https://unjobs.org/vacancies/1772201547802,,no_grade
unicef,"Consultant National chargé (e) de la gestion des vaccins pour la région de Guinée (3 mois), Kankan, Guinea",https://unjobs.org/vacancies/1772201557466,,intern_consultant
unicef,"Consultation nationale : Recrutement d'un·e consultant·e pour la documentation du processus de mise en œuvre d'une stratégie de communication de proximité 09 mois, Tunis, Tunisia",https://unjobs.org/vacancies/1772201567009,,intern_consultant
unicef,"Vacancy Announcement - Health Officer (Supply and Logistics) NOB Fixed Term, Abuja, Nigeria",https://unjobs.org/vacancies/1772201576301,,intern_consultant
unicef,"JPO-Education Officer (digital learning) P-2 (For Finnish Nationals only), Luanda, Angola",https://unjobs.org/vacancies/1772201585786,,jpo
unicef,"International Consultancy - Formative Evaluation of Polio Programme, Kabul, Afghanistan",https://unjobs.org/vacancies/1772115082261,,intern_consultant
unicef,"Consultant national Médecin spécialiste en planification et gestion des projets pour appui technique au PSLS WCAR, Cotonou, Benin",https://unjobs.org/vacancies/1772115044526,,intern_consultant
unicef,"Administrative Officer (Asset & Premises Management), Kinshasa, Democratic Republic of Congo",https://unjobs.org/vacancies/1772115034996,,no_grade
unicef,"Consultant(e) international SBC pour la réponse à l'épidémie de Polio, Bamako, Mali",https://unjobs.org/vacancies/1772115025560,,intern_consultant
unicef,"Administrateur chargé des finances, Kinshasa, Democratic Republic of Congo",https://unjobs.org/vacancies/1772114993514,,no_grade
unicef,"Social Policy Specialist, Ankara, Turkey",https://unjobs.org/vacancies/1772114983403,,no_grade
unicef,"Education Officer, Abuja, Nigeria",https://unjobs.org/vacancies/1772114961965,,no_grade
unicef,"Programme Assistant, Lima, Peru",https://unjobs.org/vacancies/1772091390565,,no_grade
unicef,"WASH Specialist, Dakar, Senegal",https://unjobs.org/vacancies/1772091371602,,no_grade
unicef,"Supply & Logistics Officer, Beijing, China",https://unjobs.org/vacancies/1772091352588,,no_grade
unicef,"Driver, Quetta, Pakistan",https://unjobs.org/vacancies/1772091343231,,no_grade
unicef,"Youth-focused Digital Content Creator Consultant for Adolescent Wellbeing and Development (National Belarus), Minsk, Belarus",https://unjobs.org/vacancies/1772091333621,,intern_consultant
unicef,"Consultoría: ""Apoyo a las actividades de evaluación de la Oficina de UNICEF Bolivia"", Modalidad, La Paz, Bolivia",https://unjobs.org/vacancies/1772091312140,,no_grade
unicef,"Consultancy - Digital Content Creator, Bangkok, Thailand",https://unjobs.org/vacancies/1772091300422,,intern_consultant
unicef,"WASH Officer, La Paz, Bolivia",https://unjobs.org/vacancies/1772091289849,,no_grade
unicef,"Senior People & Culture Associate, HR Administration (Benefits & Entitlements), UNICEF Global Shared Services Centre, Budapest",https://unjobs.org/vacancies/1772115063519,,no_grade
unicef,"WASH Knowledge Management Consultant, Programme Group, WASH Section, New York",https://unjobs.org/vacancies/1772115053955,,intern_consultant
unicef,"New Consultancy: Disability and Assistive Technology Consultant, Child Survival Centre, UNICEF Supply Division, Copenhagen",https://unjobs.org/vacancies/1772115015206,,intern_consultant
unicef,"GPE KIX Africa 19 Hub (Inclusive Education, ECE, Gender and Knowledge Exchange) Consultant, Global Education Practice, Remote",https://unjobs.org/vacancies/1772091380980,,intern_consultant
unicef,"Partnership Consultant - partnership landscape assessment with a focus on innovation as an entry point - anchored in the global practice OOI 5 months (remote), WASH Hub, Denmark, Sweden",https://unjobs.org/vacancies/1772091362044,,intern_consultant
unicef,"Project Manager, Office of Strategy & Evidence, Florence, Italy",https://unjobs.org/vacancies/1772091323492,,no_grade
unicef,"Innovation Consultant - Collaboration Strategy, Copenhagen",https://unjobs.org/vacancies/1772091278604,,intern_consultant
unicef,"Senior Adviser - Recovery, Programme Group, Global Programme Division, Rome",https://unjobs.org/vacancies/1772091265960,,no_grade
unicef,"Individual National Consultant - Logistical Support for Central Vaccine Store, Kathmandu, Nepal",https://unjobs.org/vacancies/1772114972867,,intern_consultant
unicef,"Asistencia Técnica para el Fortalecimiento y Escalamiento de Intervenciones en Salud y Primera Infancia en Panamá, Panama City, Panama",https://unjobs.org/vacancies/1772115004386,,no_grade
unicef,"International consultant on capacity building of teachers and other pre(school) professionals in model preschools and schools, Tashkent, Uzbekistan",https://unjobs.org/vacancies/1772115072804,,intern_consultant
unicef,"Health Officer, Minsk, Belarus",https://unjobs.org/vacancies/1772028188978,,no_grade
unicef,"Executive Officer, Kyiv, Ukraine",https://unjobs.org/vacancies/1772028179807,,no_grade
unicef,"International Consultant - Adaptive Social Protection (ASP) Training Expert with UNICEF, Tashkent, Uzbekistan",https://unjobs.org/vacancies/1772028161412,,intern_consultant
unicef,"Professional Photographers on Long Term Arrangement, Skopje, North Macedonia",https://unjobs.org/vacancies/1772028152156,,no_grade
unicef,"National Individual Consultant - Adaptive Social Protection (ASP) Training Expert with UNICEF, Tashkent, Uzbekistan",https://unjobs.org/vacancies/1772028133722,,intern_consultant
unicef,"National Individual Consultant on Adaptive Social Protection (ASP) Trainer with UNICEF, Tashkent, Uzbekistan",https://unjobs.org/vacancies/1772028124296,,intern_consultant
unicef,"Operations Officer, Gaza, occupied Palestinian territory",https://unjobs.org/vacancies/1772028114885,,no_grade
unicef,"Associé (e) aux Technologies de l'Information et de la Communication, Goma, Democratic Republic of Congo",https://unjobs.org/vacancies/1772028105597,,no_grade
