org_key,title,unjobs_url,original_url,exclusion_reason
unicef,"Education Officer NO-A, Tegucigalpa, Honduras",https://unjobs.org/vacancies/1773383781093,,intern_consultant
unicef,"Consultor&, Bogota, Colombia",https://unjobs.org/vacancies/1773383794201,,no_grade
unicef,"Re-advertisement: External VA_WASH Specialist NO3 Fixed Term, Sittwe, Myanmar",https://unjobs.org/vacancies/1773383805533,,no_grade
unicef,"National Consultant to Modify update develop training modules for a multidisciplinary workforce to strengthen IHR implementation ( Lankan nationals only), Colombo, Sri Lanka",https://unjobs.org/vacancies/1773383816035,,intern_consultant
unicef,"International Consultant in Peri- and Neonatal Care - Midwife, Sukhumi, Georgia",https://unjobs.org/vacancies/1773411399838,,intern_consultant
unicef,"International consultant in peri- & neonatal care - Neonatologist, Sukhumi, Georgia",https://unjobs.org/vacancies/1773411410214,,intern_consultant
unicef,"International consultant in peri- & neonatal care - Obstetrician (Team Leader) Sukhumu, Sukhumi, Georgia",https://unjobs.org/vacancies/1773411420874,,intern_consultant
unicef,"International National Consultant LSFF Programme Documentation and Roadmap Review (Home-based with travel), Jakarta, Indonesia",https://unjobs.org/vacancies/1773411431665,,intern_consultant
unicef,"Supply & Logistics Associate G6 Temporary Assignment (364 days for Chinese nationals only), Beijing, China",https://unjobs.org/vacancies/1773411442111,,no_grade
unicef,"Child Protection for UASC - Unaccompanied Separated and Undocumented Children Consultant Roraima [3months], Boa Vista, Brazil",https://unjobs.org/vacancies/1773411452401,,intern_consultant
unicef,"International Individual Consultancy for development of national standards guidelines and procedures for ECI services and staff, Podgorica, Montenegro",https://unjobs.org/vacancies/1773411461815,,intern_consultant
unicef,"International Consultant to Support the Development of Alternative Care Services and Improve Child Protection Case Management Practices, Sukhumi, Georgia",https://unjobs.org/vacancies/1773411471392,,intern_consultant
unicef,"National Consultant for the Implementation of Child Nutrition Fund in, Vientiane, Lao PDR",https://unjobs.org/vacancies/1773411480665,,intern_consultant
unicef,"WASH Officer (NO-2) FT, Caracas, Venezuela",https://unjobs.org/vacancies/1773411490457,,no_grade
unicef,"Technology for Development (T4D) Officer NO-2 Fixed Term, New Delhi, India",https://unjobs.org/vacancies/1773411546551,,no_grade
unicef,"Consultor Nacional para el desarrollo de un paquete de herramientas de formación dirigido al personal del Programa Ampliado de Inmunizaciones en el manejo mantenimiento y monitoreo de la cadena de fr&, Caracas, Venezuela",https://unjobs.org/vacancies/1773411561442,,no_grade
unicef,"Local Consultancy: Technical Oversight and Quality Assurance for Solar-Powered WASH and Renewable Energy Systems in Tawi-Tawi (Readvertised), Cotabato, Philippines",https://unjobs.org/vacancies/1773411571703,,intern_consultant
unicef,"Re-advertisement - Batch recruitment - Driver G-2 Fixed Term Position, Nairobi, Kenya",https://unjobs.org/vacancies/1773411581433,,no_grade
unicef,"Re-advertisement Logistics Officer (Immunization & Health) NOB Fixed Term, Kabul, Afghanistan",https://unjobs.org/vacancies/1773411623011,,intern_consultant
unicef,"Readvertisement: Education Officer (Digital) NO-2 UNICEF B&H, Sarajevo, Bosnia and Herzegovina",https://unjobs.org/vacancies/1773411632364,,no_grade
unicef,"Early Childhood Development (ECD) Officer (NO-2) Fixed Term, Tashkent, Uzbekistan",https://unjobs.org/vacancies/1773411641828,,no_grade
unicef,"Child Protection Officer NO-2 Temporary Appointment (364 days), Poltava, Ukraine",https://unjobs.org/vacancies/1773411651084,,no_grade
unicef,"National Consultancy - Post Discharge Community Follow-Up of Newborns (Part-time) UNICEF, Accra, Ghana",https://unjobs.org/vacancies/1773411670111,,intern_consultant
unicef,"Child protection VAC National Consultant (National Belarus) - Req, Minsk, Belarus",https://unjobs.org/vacancies/1773411679392,,intern_consultant
unicef,"WASH Officer, WASH Officer, Nzerekore, Guinea",https://unjobs.org/vacancies/1773411841317,,no_grade
unicef,"Administrative and Financial Assistant  -  Individual Giving, Administrative and Financial Assistant â Individual Giving, Brasilia, Brazil",https://unjobs.org/vacancies/1773411929646,,no_grade
unicef,"Chargé (e) de Projet National  -  PBF Jeunes de l'Axe, Chargé (e) de Projet National â PBF Jeunes de lâAxe, Conakry, Guinea",https://unjobs.org/vacancies/1773411972842,,no_grade
unicef,"Community Facilitator Assistant, Mocímboa da Praia, Mozambique",https://unjobs.org/vacancies/1773324797262,,no_grade
unicef,"Immunization Specialist, Kabul",https://unjobs.org/vacancies/1773324703864,,no_grade
unicef,"online in Southeast Asia and the Pacific and private sector engagement consultant, Bangkok",https://unjobs.org/vacancies/1773324644295,,intern_consultant
unicef,"Joint Action to Stop Wasting Learning Consultant, Nairobi",https://unjobs.org/vacancies/1773297475818,,intern_consultant
unicef,"Health Specialist (Community Health Delivery Partnership), New York",https://unjobs.org/vacancies/1773297444761,,no_grade
unicef,"Internship: Partnership and Knowledge Management Intern, UNICEF Global Learning Innovation Hub, Helsinki",https://unjobs.org/vacancies/1773297362110,,intern_consultant
unicef,"Logistics Specialist, Copenhagen",https://unjobs.org/vacancies/1773297351424,,no_grade
unicef,"Social & Behaviour Change Coordinator, Colombo, Sri Lanka",https://unjobs.org/vacancies/1773239702539,,no_grade
unicef,"Monitoring, Evaluation & Learning Officer, Nairobi, Kenya",https://unjobs.org/vacancies/1773325019963,,no_grade
unicef,"WASH Quality & Accountability Engineering Expert, Dnipro, Ukraine",https://unjobs.org/vacancies/1773324955759,,no_grade
unicef,"Child Protection Officer, Kharkiv, Ukraine",https://unjobs.org/vacancies/1773324731972,,no_grade
unicef,"Consultant(e) National pour le Développement d'un Plan de Communication en Soutien à l'Enregistrement des Naissances, Bujumbura, Burundi",https://unjobs.org/vacancies/1773324722317,,intern_consultant
unicef,"Education Specialist (Education in Emergencies and Systems Transition), Beirut, Lebanon",https://unjobs.org/vacancies/1773324713124,,no_grade
unicef,"Consultant national définition & formulation paquet d'interventions holistiques & multisectorielles conditions favorables scolarité complète de qualité des filles, Cotonou, Benin",https://unjobs.org/vacancies/1773324684808,,intern_consultant
unicef,"Consultant International National Private Sector Engagement, Conakry, Guinea",https://unjobs.org/vacancies/1773324664458,,intern_consultant
unicef,"Programme Specialist (MHPSS), Kyiv, Ukraine",https://unjobs.org/vacancies/1773324633799,,no_grade
unicef,"National Consultant - Monitoring and Evaluation Consultant State of Palestine, East Jerusalem, occupied Palestinian territory",https://unjobs.org/vacancies/1773324622514,,intern_consultant
unicef,"Programme Assistant, Santo Domingo, Dominican Republic",https://unjobs.org/vacancies/1773297496412,,no_grade
unicef,"Youth Engagement Manager (Learning and Skills), Maputo, Mozambique",https://unjobs.org/vacancies/1773297486003,,no_grade
unicef,"Communication Officer (Multimedia), Goma, Democratic Republic of Congo",https://unjobs.org/vacancies/1773297465298,,no_grade
unicef,"Consultant (e) international (e) en charge de l'élaboration de la stratégie nationale de renforcement des apprentissages fondamentaux à (International; Home-based + Travel,  Antananarivo, Madagascar",https://unjobs.org/vacancies/1773297455283,,intern_consultant
unicef,"Consultant appui renforcement mécanismes d'éducation alternative pour insertion & réinsertion filles & garçons au parcours éducatif, Cotonou, Benin",https://unjobs.org/vacancies/1773297434340,,intern_consultant
unicef,"Consultoria: Analista de datos SITAN (Situación de Niñez y Adolescencia), La Paz, Bolivia",https://unjobs.org/vacancies/1773297423871,,no_grade
