org_key,title,unjobs_url,original_url,exclusion_reason
wfp,"Partnership and Communication Officer, Monrovia, Liberia",https://unjobs.org/vacancies/1772721787968,,no_grade
wfp,"IT Solution Architect, Rome, Italy",https://unjobs.org/vacancies/1772721774045,,no_grade
wfp,"Asistente Superior de Preparación y Respuesta a Emergencias, San Salvador, El Salvador",https://unjobs.org/vacancies/1772721745696,,no_grade
wfp,"Asociado Senior de Programas, Bogota, Colombia",https://unjobs.org/vacancies/1772721731009,,no_grade
wfp,"Monitoring Assistant - Mokhotlong-1, Maseru, Lesotho",https://unjobs.org/vacancies/1772721723757,,no_grade
wfp,"Monitoring Assistant - Mohale's Hoek-2, Maseru",https://unjobs.org/vacancies/1772721716389,,no_grade
wfp,"Asociado Senior de Programas - Agua y Saneamiento, Leticia, Colombia",https://unjobs.org/vacancies/1772721701571,,no_grade
wfp,"Site Supervisor (Civil Engineer), Makeni, Sierra Leone",https://unjobs.org/vacancies/1772721694509,,no_grade
wfp,"Finance Officer (UNHAS), Bamako, Mali",https://unjobs.org/vacancies/1772721687143,,no_grade
wfp,"Asociado de Alianzas - Gestión de Reportes, Caracas, Venezuela",https://unjobs.org/vacancies/1772721671229,,no_grade
wfp,"Supply Chain Officer, Maseru, Lesotho",https://unjobs.org/vacancies/1772721664056,,no_grade
wfp,"Finance Assistant, Antananarivo, Madagascar",https://unjobs.org/vacancies/1772721648776,,no_grade
wfp,"Asesor en Protección Social Adaptativa/Reactiva ante emergencias, Guatemala City, Guatemala",https://unjobs.org/vacancies/1772721416732,,no_grade
wfp,"Programme Policy Officer, Dar es Salaam, Tanzania",https://unjobs.org/vacancies/1772721008578,,no_grade
wfp,"Assistant(e) de gestion logistique - Gestion des Fonds & Facturation, Port-au-Prince, Haiti",https://unjobs.org/vacancies/1772806356971,,no_grade
wfp,"Assistant(e) logistique / Gestion des contrats, Port-au-Prince, Haiti",https://unjobs.org/vacancies/1772806349280,,no_grade
wfp,"Global Marketing Coordinator, Search & Social, Rome, Italy",https://unjobs.org/vacancies/1772806342001,,no_grade
wfp,"Adjoint.e logistique - Gestionnaire de fonds, Port-au-Prince, Haiti",https://unjobs.org/vacancies/1772806334836,,no_grade
wfp,"Partnerships Officer, Maseru, Lesotho",https://unjobs.org/vacancies/1772806327415,,no_grade
wfp,"Programme Policy Officer- (Social Protection & Resilience), Sao Tome, Sao Tome and Principe",https://unjobs.org/vacancies/1772806319744,,no_grade
wfp,"Programme Associate, Karongi, Rwanda",https://unjobs.org/vacancies/1772806312382,,no_grade
wfp,"Auxiliar de seguimiento, San Salvador, El Salvador",https://unjobs.org/vacancies/1772892483815,,no_grade
wfp,"Senior Cloud Architect, Rome, Italy",https://unjobs.org/vacancies/1772721760233,,no_grade
wfp,"Business Transformation Officer (Data Specialist), Dhaka, Bangladesh",https://unjobs.org/vacancies/1772547398900,,no_grade
wfp,"Programme Policy Officer (Emergency Preparedness and Response), Yerevan, Armenia",https://unjobs.org/vacancies/1772630917232,,no_grade
wfp,"Programme Associate (Community Feedback Mechanism and Monitoring), Kathmandu, Nepal",https://unjobs.org/vacancies/1772630910020,,no_grade
wfp,"Research Officer, Port-au-Prince, Haiti",https://unjobs.org/vacancies/1772630902829,,no_grade
wfp,"Driver, Nouakchott, Mauritania",https://unjobs.org/vacancies/1772630895608,,no_grade
wfp,"Associe(e) aux ressources humaines, Bujumbura, Burundi",https://unjobs.org/vacancies/1772630880573,,no_grade
wfp,"Asistente de Finanzas, Caracas, Venezuela",https://unjobs.org/vacancies/1772630873512,,no_grade
wfp,"Database Associate, Beirut, Lebanon",https://unjobs.org/vacancies/1772630866379,,no_grade
wfp,"Travel Coordinator (Management Services Associate - Travel), Kathmandu, Nepal",https://unjobs.org/vacancies/1772630858753,,no_grade
wfp,"Programme Policy Officer (Food Security Monitoring and Vulnerability Analysis Specialist), Kathmandu, Nepal",https://unjobs.org/vacancies/1772630851497,,no_grade
wfp,"IT Operations Associate, Beirut, Lebanon",https://unjobs.org/vacancies/1772630844251,,no_grade
wfp,"Adjoint au Programme - Cantines Scolaires, Abidjan, Cote d'Ivoire",https://unjobs.org/vacancies/1772630826028,,no_grade
wfp,"Management Services Assistant (Fleet), Cox's Bazaar, Bangladesh",https://unjobs.org/vacancies/1772630924559,,no_grade
wfp,"Programme Policy Officer (GAFSP Project Provincial Coordinator), Surkhet, Nepal",https://unjobs.org/vacancies/1772630836899,,no_grade
wfp,"Programme Policy Officer (Nutrition), Manakara, Madagascar",https://unjobs.org/vacancies/1772547489973,,no_grade
wfp,"Programme Policy Officer (Emergency Preparedness and Response), Kathmandu, Nepal",https://unjobs.org/vacancies/1772547474602,,no_grade
wfp,"Programme Policy Officer - Social Protection, Antananarivo, Madagascar",https://unjobs.org/vacancies/1772547459231,,no_grade
wfp,"IT Associate (Data Analyst), Dhaka, Bangladesh",https://unjobs.org/vacancies/1772547451968,,no_grade
wfp,"Internship - External Relations Team, Brussels, Belgium",https://unjobs.org/vacancies/1772547444662,,intern_consultant
wfp,"Programme Policy Officer (Agri assurance), Antananarivo, Madagascar",https://unjobs.org/vacancies/1772547437255,,no_grade
wfp,"Business Transformation Officer (Business Engagement), Dhaka, Bangladesh",https://unjobs.org/vacancies/1772547429933,,no_grade
wfp,"Management Services Assistant, Beijing, China",https://unjobs.org/vacancies/1772547422176,,no_grade
wfp,"Communications Officer, Junior Consultant, WFP Nordic Office, Copenhagen, Denmark",https://unjobs.org/vacancies/1772547414131,,intern_consultant
wfp,"Programme Associate (Resilience), Taolagnaro, Fort-Dauphin, Madagascar",https://unjobs.org/vacancies/1772547406295,,no_grade
wfp,"Earth Observation Analyst, Consultant Level-1, Remote, Freetown, Sierra Leone",https://unjobs.org/vacancies/1772460868467,,intern_consultant
wfp,"Communications Assistant, Gaza, occupied Palestinian territory",https://unjobs.org/vacancies/1772460861029,,no_grade
wfp,"Monitoring Assistant, Makeni, Sierra Leone",https://unjobs.org/vacancies/1772460853243,,no_grade
